Topic,Keywords,Title,Language,WordCount,Status,ArticleURL,PublishDate,ErrorMessage
Как выбрать CRM систему,"crm, система, бизнес, автоматизация",Полное руководство по выбору CRM системы для бизнеса в 2024,Russian,2500,Pending,,,
Best SEO tools 2024,"seo, tools, marketing, optimization",Top 10 SEO Tools Every Marketer Needs in 2024,English,3000,Pending,,,
Искусственный интеллект в маркетинге,"AI, искусственный интеллект, маркетинг, автоматизация",Как использовать AI в маркетинге: практическое руководство,Russian,2000,Pending,,,
Email marketing automation,"email, automation, marketing, campaigns",Complete Guide to Email Marketing Automation,English,2800,Pending,,,
Создание лендинга,"лендинг, посадочная страница, конверсия",Как создать продающий лендинг: пошаговое руководство,Russian,3200,Pending,,,
